{
  "id": "slovakia-susr",
  "name": {
    "en": "Statistical Office of the Slovak Republic (SUSR)",
    "zh": "斯洛伐克共和国统计局"
  },
  "description": {
    "en": "Official statistical authority of the Slovak Republic (Štatistický úrad Slovenskej republiky, ŠÚSR), responsible for coordinating and producing official national statistics in areas such as economics, social conditions, demographics, and the environment. Publishes EU-harmonized data in compliance with EUROSTAT requirements.",
    "zh": "斯洛伐克共和国官方统计机构（Štatistický úrad Slovenskej republiky，ŠÚSR），负责协调和生产经济、社会状况、人口和环境领域的官方国家统计数据，遵循欧盟EUROSTAT要求发布协调统计。"
  },
  "website": "https://statistics.sk",
  "data_url": "https://datacube.statistics.sk",
  "api_url": null,
  "authority_level": "government",
  "country": "SK",
  "geographic_scope": "national",
  "update_frequency": "monthly",
  "domains": [
    "demographics",
    "economics",
    "employment",
    "trade",
    "agriculture",
    "environment",
    "social"
  ],
  "tags": [
    "slovakia",
    "斯洛伐克统计",
    "SUSR",
    "ŠÚSR",
    "eu-member",
    "europe",
    "official-statistics",
    "datacube",
    "population",
    "gdp",
    "eurostat-harmonized",
    "central-europe",
    "国家统计"
  ],
  "data_content": {
    "en": [
      "National accounts - GDP, GVA, productivity and output",
      "Population census and demographic projections",
      "Labour force survey - employment, unemployment, wages and earnings",
      "Consumer Price Index and harmonized inflation (HICP)",
      "Foreign trade statistics by commodity and partner country",
      "Agricultural production, livestock and land use",
      "Industrial production index and business statistics",
      "Regional statistics at NUTS 2 and NUTS 3 level",
      "Tourism, accommodation and hospitality statistics",
      "Education indicators and research & development data",
      "Health, social protection and poverty statistics",
      "Environment and sustainable development indicators"
    ],
    "zh": [
      "国民账户 - GDP、GVA、生产力和产出",
      "人口普查和人口预测",
      "劳动力调查 - 就业、失业率、工资和薪酬",
      "消费者价格指数和欧盟协调通胀率（HICP）",
      "按商品和伙伴国分类的对外贸易统计",
      "农业生产、牲畜和土地利用",
      "工业生产指数和商业统计",
      "NUTS 2和NUTS 3级别的区域统计",
      "旅游、住宿和酒店业统计",
      "教育指标和研发数据",
      "卫生、社会保障和贫困统计",
      "环境和可持续发展指标"
    ]
  }
}
